ID ;Administracion;ID Colegio;Colegio;Cant de estudiantes;Promedio PSU;Promedio NEM
2;Particular Subvencionado;2434;Blas Pascal School;51;571,5851064;5,682352917
2;Particular Subvencionado;2435;Colegio San Cristóbal (LOS MUERMOS);38;436,0277778;5,331315781
2;Particular Subvencionado;2436;Colegio de Niñas Nuestra Señora de Lourdes;27;431,95;5,493333375
2;Particular Subvencionado;2437;Colegio Luis Pasteur;122;489,2407407;5,534590197
2;Particular Subvencionado;2438;Liceo de Adultos Crecer Osorno;27;448,9375;5,515185162
2;Particular Subvencionado;2439;Colegio Nacional de la Unión;2;349,75;5,430000067
2;Particular Subvencionado;2440;Colegio Los Torreones;9;530,5;5,526666694
2;Particular Subvencionado;2441;Corporación de Educación la Araucana (PUERTO MONTT);206;449,1416185;5,19442786
2;Particular Subvencionado;2442;Colegio Union College;2;543,5;5,955000162
2;Particular Subvencionado;2443;Colegio Puerto Montt;45;476,1744186;5,472000006
2;Particular Subvencionado;2444;Colegio Cardenal Raúl Silva Henríquez;28;466,0925926;5,700000031
2;Particular Subvencionado;2445;Dharma College;23;412,15;5,496086971
2;Particular Subvencionado;2446;Liceo Técnico Profesional Inmaculada Concepción;18;461,5;5,656111108
2;Particular Subvencionado;2447;Centro Educacional San Agustín;29;629,56;5,982068983
2;Particular Subvencionado;2448;Instituto Inmaculada Concepción;92;612,7294118;5,875108693
2;Particular Subvencionado;2449;Colegio San Andrés (OSORNO);16;364,7777778;5,639333375
2;Particular Subvencionado;2450;Colegio Paideia (PUERTO MONTT);18;508,2941176;5,599999984
2;Particular Subvencionado;2451;Colegio Inglés (OSORNO);50;472,1860465;5,434200029
2;Particular Subvencionado;2452;Colegio Particular Antares de Alerce;8;406,75;5,359999955
2;Particular Subvencionado;2453;Colegio Robert Pace;2;478,75;5,340000153
2;Particular Subvencionado;2454;Complejo Educacional San Crescente;40;544,7837838;5,817000008
2;Particular Subvencionado;2455;Instituto Tecnológico del Sur;141;387,6095238;5,287857127
2;Particular Subvencionado;2456;Colegio Camilo Henríquez (VALDIVIA);2;515,5;5,515000105
2;Particular Subvencionado;2457;Centro de Educacional de Adultos Sandrock;161;437,8208955;5,185279497
2;Particular Subvencionado;2458;Colegio Técnico Profesional Santa Teresa de Los Andes;62;428,6976744;5,547258054
2;Particular Subvencionado;2459;Colegio Aliwén;17;531,9411765;5,822941191
2;Particular Subvencionado;2460;Centro de Educación de Adultos Esmeralda;39;457,5483871;5,463846133
2;Particular Subvencionado;2461;Centro Educacional de Adultos Diego Portales;145;475,2067669;5,341180553
2;Particular Subvencionado;2462;Colegio Creación Osorno;85;578,7962963;5,830000003
2;Particular Subvencionado;2463;Centro Educacional Insprol;1;;6,449999809
2;Particular Subvencionado;2464;Colegio Domingo Santa María (PUERTO MONTT);171;594,621875;5,559298267
2;Particular Subvencionado;2465;The Mission College;58;464,84;5,49086209
2;Particular Subvencionado;2466;Colegio Tornagaleones;16;436,8;5,49000001
2;Particular Subvencionado;2467;Centro de Educacional de Adultos Elier;3;444;5,776666641
2;Particular Subvencionado;2468;Centro Educ. Integral Adultos Profasoc;63;413,9333333;5,52555555
2;Particular Subvencionado;2469;Colegio Rucalén;1;;5,800000191
2;Particular Subvencionado;2470;Liceo Técnico Profesional Helvecia;3;476;5,303333282
2;Particular Subvencionado;2471;Colegio Preciosa Sangre II;15;535,6111111;5,640000025
2;Particular Subvencionado;2472;Colegio Laico Valdivia;55;505,2708333;5,492363618
2;Particular Subvencionado;2473;Colegio Bernardo Felmer Niklitschek;53;462,5;5,736226433
2;Particular Subvencionado;2474;Liceo de Administración y Comercio San Sebastián;103;421,778481;5,488252455
2;Particular Subvencionado;2475;Colegio Lafquén Montessori Puerto Montt;23;550,5263158;5,866956503
2;Particular Subvencionado;2476;Instituto Aprender (PUERTO MONTT);51;422,8709677;5,362549034
2;Particular Subvencionado;2477;Instituto Aprender (FRESIA);206;392,733871;5,350682926
2;Particular Subvencionado;2478;Colegio Politécnico Degli Monti;5;425,625;5,592000008
2;Particular Subvencionado;2479;Centro Educacional Amancay;45;416,1851852;5,108181813
2;Particular Subvencionado;2480;Colegio de Adultos Pudeto;6;440,5;5,345000029
2;Particular Subvencionado;2481;Liceo Técnico Profesional Agrícola Marítimo Bosque Nativo;139;437,3055556;5,594316568
2;Particular Subvencionado;2482;Colegio Particular Cardenal Raúl Silva Henríquez;39;457,6571429;5,588205154
2;Particular Subvencionado;2483;Centro Educacional San Nicolás;32;425,6428571;5,447187498
2;Particular Subvencionado;2484;Instituto Inglés Antuquenu;110;484,62;5,396545449
2;Particular Subvencionado;2485;Colegio Águilas del Sur;26;453,9047619;5,646153835
2;Particular Subvencionado;2486;Colegio Charles Darwin de Ancud;23;482,2857143;5,5627273
2;Particular Subvencionado;2487;Centro de Educación de Adultos Aprender (PUERTO OCTAY);1;;5,199999809
2;Particular Subvencionado;2488;Centro Integral de Adultos Treucanche;10;463,2;5,59800005
2;Particular Subvencionado;2489;Instituto Cristiano Gracia y Paz;160;475,0472973;5,366000009
2;Particular Subvencionado;2490;Colegio Cordillera (OSORNO);28;441,8043478;5,393928579
2;Particular Subvencionado;2491;Colegio San Alberto Hurtado (OSORNO);29;567,9230769;5,745172418
2;Particular Subvencionado;2492;Instituto Cecal Sur;34;378,1153846;5,562058785
2;Particular Subvencionado;2493;Liceo Técnico Profesional Gabriela Mistral;35;407,3809524;5,410285745
2;Particular Subvencionado;2494;Colegio Cristiano La Unión;36;463,6363636;5,511666682
2;Particular Subvencionado;2495;Colegio Colonos de Alerce;35;505,4558824;5,928000028
2;Particular Subvencionado;2496;Liceo Técnico Adolfo Matthei;54;478,5377358;5,587592575
2;Particular Subvencionado;2497;Liceo Técnico Profesional San José;59;442,6041667;5,52559324
2;Particular Subvencionado;2498;Saint Paul College;33;497,0625;5,76030302
2;Particular Subvencionado;2499;Instituto Aprender (HUALAIHUE);4;348,25;5,707499981
2;Particular Subvencionado;2500;Colegio Chileno Norteamericano;67;530,5241935;5,616716399
2;Particular Subvencionado;2501;Colegio de Adultos Bonilla;7;415;5,342857225
2;Particular Subvencionado;2502;Liceo Técnoco Profesional de Adultos Coresol de Valdivia;51;341,7666667;5,687599993
2;Particular Subvencionado;2503;Instituto Príncipe de Asturias;120;483;5,871666702
2;Particular Subvencionado;2504;Centro Educacional Integral de Adultos Arturo Prat;14;404,7857143;5,45285712
2;Particular Subvencionado;2505;Liceo Técnico Profesional de Adultos Coresol de Puerto Montt;42;349,2432432;5,517857154
2;Particular Subvencionado;2506;Colegio Sagrada Familia (HUALAIHUE);14;443,2692308;5,769285815
2;Particular Subvencionado;2507;Royal School;2;475;5,575000048
2;Particular Subvencionado;2508;Centro de Estudios la Araucana (PUERTO MONTT);31;437,875;4,995806433
2;Particular Subvencionado;2509;Colegio Altas Cumbres (PUERTO VARAS);18;464,5555556;5,624444458
2;Particular Subvencionado;2510;Escuela Hospitalaria Hospital Base de Puerto Montt;1;404;6,380000114
2;Particular Subvencionado;2511;Colegio Britisch Royal School;2;365,5;4,965000153
2;Particular Subvencionado;2512;Colegio British Royal School Puerto Varas;2;430,5;4,7900002
2;Particular Subvencionado;2513;Patagonia College;57;582,9423077;5,746842117
2;Particular Subvencionado;2514;Instituto Técnico Alerce Cordillera;38;439,2407407;5,464736851
2;Particular Subvencionado;2515;Centro Educación Adultos Wiclef;5;462,625;5,120000076
2;Particular Subvencionado;2516;Liceo People Help People;28;472,42;5,611785718
2;Particular Subvencionado;2517;Liceo Politécnico Werner Grob Stolzenbach;51;427,5731707;5,647647082
2;Particular Subvencionado;2518;Centro Integral de Educación Alborada (COIHAIQUE);40;513,1515152;5,524250019
2;Particular Subvencionado;2519;Liceo San José U.R.;104;566,9450549;5,751262179
2;Particular Subvencionado;2520;Colegio Alianza Austral de Coyhaique;73;597,703125;5,967222207
2;Particular Subvencionado;2521;Colegio Santa Teresa de Los Andes;25;576,3809524;5,748399982
2;Particular Subvencionado;2522;Colegio Antoine de Saint Exupery;92;514,8529412;5,415217405
2;Particular Subvencionado;2523;Colegio Bautista El Shaddai;3;512,25;5,570000013
2;Particular Subvencionado;2524;Colegio Kalem;30;508,2222222;5,677333323
2;Particular Subvencionado;2525;Colegio Diego Portales (COIHAIQUE);42;493,8333333;5,479999996
2;Particular Subvencionado;2526;Colegio Inglés Coyhaique;31;419,5294118;5,387096805
2;Particular Subvencionado;2527;Colegio Campo de Hielo;2;392;5,299999952
2;Particular Subvencionado;2528;CEIA  JOSEFINA MENDEZ E.I.R.L.;60;439,8181818;5,558166679
2;Particular Subvencionado;2529;Centro de Estudios Patagonia Ltda;120;407,6231884;5,54941177
2;Particular Subvencionado;2530;Centro de Estudios Patagonia de Aysén;109;406,0945946;5,352568828
2;Particular Subvencionado;2531;Colegio Pierre Faure;48;523,6444444;5,893124998
2;Particular Subvencionado;2532;Colegio Puerto Natales;123;433,9386792;5,571707315
2;Particular Subvencionado;2533;Colegio Punta Arenas;90;506,8223684;5,601888911
2;Particular Subvencionado;2534;Liceo Experimental Umag;118;559,3571429;5,738050865
2;Particular Subvencionado;2535;Liceo San José;154;563,5;5,629155843
2;Particular Subvencionado;2536;Fundación para el Desarrollo;48;452,0645161;5,493750006
2;Particular Subvencionado;2537;Colegio Luterano;46;481,1162791;5,736956524
2;Particular Subvencionado;2538;Colegio Polivalente Lovaina;50;470,9347826;5,220200033
2;Particular Subvencionado;2539;Colegio Santa Teresa de Jesús de Los Andes (HUECHURABA) (24407);18;405,4;5,214444399
2;Particular Subvencionado;2540;Colegio Santa María de la Cordillera;131;573,8319672;5,74702292
2;Particular Subvencionado;2541;Colegio San Juan Diego;90;547,3313953;5,817888901
2;Particular Subvencionado;2542;Escuela Particular Philippe Cousteau;66;446,4545455;5,30727273
2;Particular Subvencionado;2543;Colegio San Viator (MACUL);118;578,2522936;5,952118663
2;Particular Subvencionado;2544;Colegio Merryland;47;528,4166667;5,631702119
2;Particular Subvencionado;2545;Liceo Agrícola Santa Ana;29;396,9615385;5,586896551
2;Particular Subvencionado;2546;Complejo Educacional Agrícola de Talagante;41;424,5416667;5,288048826
2;Particular Subvencionado;2547;Colegio Artístico El Salvador Anexo;34;476,3387097;5,485294146
2;Particular Subvencionado;2548;Escuela Básica Talleres Prevocacional Hogar de Cristo;52;407,2794118;5,270961514
2;Particular Subvencionado;2549;Colegio Particular Kronberg College;21;525,7666667;5,423333327
2;Particular Subvencionado;2550;Colegio Tec. Hotelería y Gastronomía Achiga Comeduc;170;471,2591241;5,286823522
2;Particular Subvencionado;2551;Liceo Politécnico Particular Andes;320;505,6072727;5,463781266
2;Particular Subvencionado;2552;Colegio Polivalente San Rafael;56;606,4489796;5,858909069
2;Particular Subvencionado;2553;Colegio Comercial de Peñaflor;66;431,8508772;5,397878777
2;Particular Subvencionado;2554;Colegio San Joaquín (RENCA);38;573,3088235;5,653421063
2;Particular Subvencionado;2555;Escuela Industrial Saint Lawrence;1;549;5,400000095
2;Particular Subvencionado;2556;Instituto Comercial Saint Lawrence;3;394,5;5,083333333
2;Particular Subvencionado;2557;Chilean Eagles College (CERRILLOS);1;503,5;4,75
2;Particular Subvencionado;2558;Instituto Comercial Particular D Madrid;2;375,25;5,065000057
2;Particular Subvencionado;2559;Liceo Liahona;1;523;5,650000095
2;Particular Subvencionado;2560;Escuela Particular Paulina Von Mallinckrodt;1;466;5,300000191
2;Particular Subvencionado;2561;Liceo Particular Britania Cordillera;1;450,5;5,25
2;Particular Subvencionado;2562;Colegio London Anexo;150;431,3291667;5,229600039
2;Particular Subvencionado;2563;Escuela Jorge Alessandri Rodríguez Anexo;71;505,6209677;5,458028175
2;Particular Subvencionado;2564;Colegio San Cristóbal College;58;550,2272727;5,487068982
2;Particular Subvencionado;2565;Complejo Educacional Alberto Widmer;313;483,7910714;5,695878608
2;Particular Subvencionado;2566;Colegio Los Nogales;136;599,9631148;5,773851847
2;Particular Subvencionado;2567;Escuela Agroecológica de Pirque;93;458,4144737;5,604946249
2;Particular Subvencionado;2568;Colegio El Almendral;10;437,625;5,486000013
2;Particular Subvencionado;2569;Colegio San Manuel (MELIPILLA);56;532,8076923;5,78714289
2;Particular Subvencionado;2570;Colegio Piamarta;501;496,7331887;5,298123772
2;Particular Subvencionado;2571;Liceo Polivalente Santiago de Compostela;163;441;5,64766871
2;Particular Subvencionado;2572;Centro Educacional Católico Didascalio Sta. Maria;23;466,0625;5,861739117
2;Particular Subvencionado;2573;Liceo San Pablo;1;;5,730000019
2;Particular Subvencionado;2574;Centro Educacional Adultos Américo Vespucio;41;417,2333333;5,303076891
2;Particular Subvencionado;2575;Instituto de A. Manuel Bulnes Prieto;7;427,2;4,701428618
2;Particular Subvencionado;2576;Colegio El Bosque Provincia Cordillera;72;582,7698413;5,846197175
2;Particular Subvencionado;2577;Colegio Santo Tomás (LA PINTANA);12;483,0909091;5,754999995
2;Particular Subvencionado;2578;Colegio Nuestra Señora de Guadalupe;45;504,975;5,626000002
2;Particular Subvencionado;2579;Colegio Adventista Santiago Poniente;42;496,2948718;5,739761932
2;Particular Subvencionado;2580;Colegio San Andrés de Colina;154;452,7907801;5,333725502
2;Particular Subvencionado;2581;Colegio Nazaret de La Florida;88;520,7;5,634659106
2;Particular Subvencionado;2582;COLEGIO CRISTIANO BETHEL  N 3;11;445,6875;5,404545524
2;Particular Subvencionado;2583;Escuela Nuestra Señora del Carmen de Curacaví;21;527,3095238;5,797142846
2;Particular Subvencionado;2584;Liceo Adultos Part. Las Américas Modernas;27;408,952381;5,359230812
2;Particular Subvencionado;2585;Colegio Almendral;67;488,21875;5,405671653
2;Particular Subvencionado;2586;Colegio El Sembrador Anexo 2;134;530,1601563;5,532835829
2;Particular Subvencionado;2587;Colegio San Isaac Jogues;53;489,3333333;5,512830212
2;Particular Subvencionado;2588;Colegio Politécnico Avda Independencia;6;365;5,566666683
2;Particular Subvencionado;2589;Colegio Monteverde Anexo;93;525,1666667;5,27333336
2;Particular Subvencionado;2590;Colegio El Prado;41;462,575;5,414878089
2;Particular Subvencionado;2591;Colegio Florida High School;73;544,3636364;5,624109621
2;Particular Subvencionado;2592;Colegio Polivalente San José de Renca;48;495,7173913;5,366250018
2;Particular Subvencionado;2593;Colegio Melipilla;1;507,5;4,880000114
2;Particular Subvencionado;2594;Colegio Ensenada;59;505,2232143;5,475172396
2;Particular Subvencionado;2595;Liceo Politécnico Particular El Señor de Renca;108;411,8297872;5,301296287
2;Particular Subvencionado;2596;Colegio Polivalente San Luis Beltrán;64;468,1696429;5,507301626
2;Particular Subvencionado;2597;Colegio San Cristóbal de Las Casas;99;499,6315789;5,438265324
2;Particular Subvencionado;2598;Centro Educacional Fernando de Aragón;293;458,0670996;5,382013656
2;Particular Subvencionado;2599;Colegio King School Cordillera;239;455,7877358;5,388987334
2;Particular Subvencionado;2600;Colegio Polivalente Araucaria;37;443,7121212;5,4443243
2;Particular Subvencionado;2601;Colegio Araucaria Cordillera;76;508,7285714;5,602894758
2;Particular Subvencionado;2602;Colegio San Francisco Misionero;62;500,6634615;5,604193541
2;Particular Subvencionado;2603;Liceo de Adultos Particular Fermín Vivaceta;34;438,12;5,289117603
2;Particular Subvencionado;2604;Colegio Nuestra Señora de la Merced;18;553,3333333;5,849444442
2;Particular Subvencionado;2605;Centro Educacional de Adultos (CERRO NAVIA);56;401,9193548;5,38509088
2;Particular Subvencionado;2606;Centro Educacional Fundación Paula Jaraquemada;56;423,6184211;5,389285752
2;Particular Subvencionado;2607;Colegio Polivalente Siembra;26;466,9791667;5,663461538
2;Particular Subvencionado;2608;Colegio Desiree;214;478,3862434;5,594112162
2;Particular Subvencionado;2609;Colegio Jorge Huneeus Zegers;267;461,2202643;5,429586484
2;Particular Subvencionado;2610;Colegio Técnico Profesional Nocedal;51;571,0520833;5,41921567
2;Particular Subvencionado;2611;Escuela Básica Particular de Santa María;19;457,5;5,450526363
2;Particular Subvencionado;2612;Colegio San Felipe;47;465,5;5,60217394
2;Particular Subvencionado;2613;Colegio Padre Hurtado de Pudahuel;37;390,8958333;5,316285746
2;Particular Subvencionado;2614;Colegio Particular Politécnico Eyzaguirre;280;447,193133;5,445428591
2;Particular Subvencionado;2615;Colegio San Fernando de Puente Alto;50;461,6136364;5,39380003
2;Particular Subvencionado;2616;Colegio Particular San Sebastián de Melipilla;178;517,4588608;5,638426966
2;Particular Subvencionado;2617;Centro de Educación Paula Jaraquemada;46;395,4137931;5,414318171
2;Particular Subvencionado;2618;Instituto San Pablo Misionero (SAN BERNARDO) (25020);2;639,5;6,339999914
2;Particular Subvencionado;2619;Escuela Básica Particular Madre de Jesús;81;520,24;5,618500012
2;Particular Subvencionado;2620;Colegio Polivalente Francisco de Villagra;50;446,3452381;5,3204
2;Particular Subvencionado;2621;Colegio Polivalente Nueva Nazaret;87;461,1097561;5,46896553
2;Particular Subvencionado;2622;Centro Educacional Diego de Almagro;70;420,6851852;5,372428594
2;Particular Subvencionado;2623;Complejo Educacional Los Andes;163;443,4854015;5,363742331
2;Particular Subvencionado;2624;Colegio Polivalente Sembrador;90;444,82;5,479666678
2;Particular Subvencionado;2625;Colegio José Manuel Balmaceda de Melipilla;40;450,9605263;5,355749989
2;Particular Subvencionado;2626;Colegio Castelgandolfo;76;597,1527778;5,890000006
2;Particular Subvencionado;2627;Colegio Particular San Mateo;66;464,2211538;5,221515186
2;Particular Subvencionado;2628;Centro Educacional Larún Rayún;78;497,0217391;5,570000019
2;Particular Subvencionado;2629;Colegio Polivalente Raulí;44;427,0517241;5,332727291
2;Particular Subvencionado;2630;MASTER`S  COLLEGE;1;489,5;5,179999828
2;Particular Subvencionado;2631;Colegio Polivalente Educadora Elena Rojas;121;431,6363636;5,27413224
2;Particular Subvencionado;2632;Colegio Navarra;48;545,423913;5,568541706
2;Particular Subvencionado;2633;Colegio José Abelardo Núñez Murúa;107;496,8;5,525233652
2;Particular Subvencionado;2634;Colegio Técnico Profesional Aprender;94;442,0571429;5,530212788
2;Particular Subvencionado;2635;Escuela Rudolf Deck Werth;34;477,2272727;5,485588256
2;Particular Subvencionado;2636;Centro Educacional Renca;7;406,375;5,127142838
2;Particular Subvencionado;2637;Escuela Básica Boston College Maipú;211;540,5569307;5,479431272
2;Particular Subvencionado;2638;Colegio Particular San Esteban de Las Viscacha;25;467,9130435;5,403600006
2;Particular Subvencionado;2639;Colegio Particular Logrono;25;456,225;5,406400013
2;Particular Subvencionado;2640;Colegio Coronel Eleuterio Ramírez Molina;155;528,6107143;5,47480521
2;Particular Subvencionado;2641;Colegio Particular de Adultos Sochides;1;;4,96999979
2;Particular Subvencionado;2642;Escuela Básica Particular Iberoamericano;98;460,96875;5,475714304
2;Particular Subvencionado;2643;Colegio San Antonio de Colina;59;523,0277778;5,498813573
2;Particular Subvencionado;2644;Escuela Particular Master School de Lampa;46;486,4204545;5,536086932
2;Particular Subvencionado;2645;Complejo Educacional San Alfonso;63;408,9787234;5,224285724
2;Particular Subvencionado;2646;Colegio Albert Einstein (RECOLETA);45;516,7;5,587111134
2;Particular Subvencionado;2647;Colegio Particular Nueva Era Siglo XXI;224;558,8293269;5,664464301
2;Particular Subvencionado;2648;Colegio Victoriano;41;483,3108108;5,404102558
2;Particular Subvencionado;2649;Colegio de Miraflores de Malloco;3;499,3333333;5,303333282
2;Particular Subvencionado;2650;Colegio Particular Los Olmos de Puente Alto;53;475,45;5,309615383
2;Particular Subvencionado;2651;Centro Educacional Principado de Asturias;73;476,1818182;5,240547957
2;Particular Subvencionado;2652;Centro Educacional de Adultos El Prado;59;476,9795918;5,34898307
2;Particular Subvencionado;2653;Washington Center la Florida;21;461,875;5,149047579
2;Particular Subvencionado;2654;Colegio Particular Ozanam;111;537,7815534;5,670360376
2;Particular Subvencionado;2655;Pierre Teilhard de Chardin;83;526,4350649;5,632409659
2;Particular Subvencionado;2656;Colegio Particular San Valentín de Maipú;42;516,8658537;5,579047612
2;Particular Subvencionado;2657;Colegio Santa Maria de Maipú;224;548,1529126;5,662702715
2;Particular Subvencionado;2658;Liceo Técnico Profesional Malloco;68;422,0350877;5,462794129
2;Particular Subvencionado;2659;Colegio Poliv. Gerónimo de Alderete;119;490,4108911;5,268823519
2;Particular Subvencionado;2660;Extremadura de Puente Alto;97;537,7826087;5,54567015
2;Particular Subvencionado;2661;Colegio Alma Mater;68;424,4758065;5,552500017
2;Particular Subvencionado;2662;Colegio Monte de Asís;91;590,4625;5,893296719
2;Particular Subvencionado;2663;Colegio de Adultos Gladys Lazo;138;425,0280374;5,206884032
2;Particular Subvencionado;2664;Colegio Centro Educacional Altair;40;538,7;5,884871789
2;Particular Subvencionado;2665;COLEGIO PARTICULAR TANTAUCO  EL BOSQUE;113;572,852381;5,699911518
2;Particular Subvencionado;2666;Colegio Poliv. Almendral de La Pintana;86;526,152439;5,578837184
2;Particular Subvencionado;2667;Instituto Capitán José Luis Araneda C.;1;553,5;5,429999828
2;Particular Subvencionado;2668;Escuela Básica The Forest College;70;522,4318182;5,546428592
2;Particular Subvencionado;2669;Colegio Poliv. Santa Cecilia de Maipú;52;461,2317073;5,317692298
2;Particular Subvencionado;2670;Colegio Antil Mawida;85;475,6455696;5,352380963
2;Particular Subvencionado;2671;Colegio Nuevo Diego de Almagro;44;534,4878049;5,457209288
2;Particular Subvencionado;2672;Colegio Particular de Adultos Itsa;36;404,859375;5,219428553
2;Particular Subvencionado;2673;Colegio Poliv. Cardenal Raúl Silva Henríquez;173;523,3571429;5,660867052
2;Particular Subvencionado;2674;Escuela Básica Particular Esjelavi;10;418,9285714;5,503000021
2;Particular Subvencionado;2675;Centro Educacional Hugo Trivelli Franzolini;1;362,5;5,050000191
2;Particular Subvencionado;2676;Escuela Básica Nuevos Castaños de Maipú;30;479,1086957;5,543448333
2;Particular Subvencionado;2677;Centro Educacional Laura Vicuña;37;397,6206897;5,042972977
2;Particular Subvencionado;2678;Colegio Paul Harris School;153;463,575188;5,322156856
2;Particular Subvencionado;2679;Centro Educacional de Adultos Rafael Sotomayor;43;419,1206897;5,403953519
2;Particular Subvencionado;2680;Colegio Particular Saint Joseph;1;513;
2;Particular Subvencionado;2681;Instituto Cristiano Luis Gandarillas;81;536,2697368;5,539753101
2;Particular Subvencionado;2682;Colegio Polivalente Antares;9;430,2142857;5,222222275
2;Particular Subvencionado;2683;Escuela Básica El Sauce;2;477;5,775000095
2;Particular Subvencionado;2684;Escuela Raimapu-Tierra Florida;105;568,6086957;5,826761904
2;Particular Subvencionado;2685;Colegio Sebastián El Cano San Bernardo;89;528,2294118;5,506404486
2;Particular Subvencionado;2686;Colegio Particular Melford College;48;512,9333333;5,380208323
2;Particular Subvencionado;2687;Colegio Poliv. Patricio Mekis de Padre Hurtado;205;450,8028571;5,500643558
2;Particular Subvencionado;2688;Colegio Metodista de Santiago;50;481,7340426;5,357959193
2;Particular Subvencionado;2689;Colegio Australia;22;434,5555556;5,450000026
2;Particular Subvencionado;2690;Colegio Santiago;111;537,8867925;5,661818184
2;Particular Subvencionado;2691;Colegio Part. Cardenal Carlos Oviedo Cavada;133;506,4297521;5,727744361
2;Particular Subvencionado;2692;Colegio Particular Alicante;421;568,4884615;5,542171853
2;Particular Subvencionado;2693;Colegio Santa María de Paine;136;511,3185484;5,625367648
2;Particular Subvencionado;2694;Escuela Particular Edial II;2;479;5,199999809
2;Particular Subvencionado;2695;Colegio Saint Charles College La Florida;32;485,95;5,628124997
2;Particular Subvencionado;2696;Colegio Particular Novo Mundo;103;479,0265957;5,4732039
2;Particular Subvencionado;2697;Colegio Particular San Sebastián de Quilicura;184;478,3819876;5,468961747
2;Particular Subvencionado;2698;Colegio Obispo Alvear;132;572,6382114;5,657878793
2;Particular Subvencionado;2699;Colegio Quinto Centenario Cordillera;51;488,2222222;5,489411775
2;Particular Subvencionado;2700;Colegio Betterland School;41;465,1944444;5,532926839
2;Particular Subvencionado;2701;Centro Politécnico Particular Conchalí;126;443,3853211;5,297063513
2;Particular Subvencionado;2702;COL.  PART. SALES. EL PATROCINIO DE SAN JOSE;109;629,0927835;5,92119269
2;Particular Subvencionado;2703;Colegio Poliv. San Bernardo Abad;125;429,2897727;5,351774185
2;Particular Subvencionado;2704;Colegio Particular Forjadores;59;526,8235294;5,606101666
2;Particular Subvencionado;2705;Colegio Part. Sochides Renca;2;455;5,299999952
2;Particular Subvencionado;2706;Centro Educacional San Carlos de Aragón;216;530,3693467;5,366448612
2;Particular Subvencionado;2707;Colegio Talagante Garden School;79;536,8269231;5,734743607
2;Particular Subvencionado;2708;Colegio Valle de Mallarauco;30;412,2;5,549333318
2;Particular Subvencionado;2709;Centro Educacional Niño Dios de Malloco;199;442,8178808;5,477106612
2;Particular Subvencionado;2710;Colegio Saltairam;20;451,7631579;5,296499991
2;Particular Subvencionado;2711;Colegio Part. Andino Antuquelén;43;502,7567568;5,643809557
2;Particular Subvencionado;2712;Colegio Adultos Inst. Barros Arana;9;445,8125;5,135555585
2;Particular Subvencionado;2713;Colegio Polivalente Falcon College;102;430,1516854;5,254215689
2;Particular Subvencionado;2714;Colegio Alto Gabriela;66;482,9482759;5,322121208
2;Particular Subvencionado;2715;COLEGIO CTRO. INTEG  ADULTOS ALTAZOL;267;446,6170213;5,313563223
2;Particular Subvencionado;2716;Colegio Polivalente Agustiniano de El Bosque;194;602,6823204;5,674218764
